som_mouse_1_1,,,,,,,,,,,,
0.0081062,733,DNA strand renaturation,biological process,6259,DNA metabolic process,,,,,,,The identification and annealing of complementary base pairs in single-strand DNA. [GOC:elh]
0.0081062,2906,negative regulation of mature B cell apoptotic process,biological process,2903,negative regulation of B cell apoptotic process,2905,regulation of mature B cell apoptotic process,,,,,"Any process that stops, prevents, or reduces the frequency, rate, or extent of mature B cell apoptosis. [GOC:add]"
0.0081062,3198,epithelial to mesenchymal transition involved in endocardial cushion formation,biological process,60317,cardiac epithelial to mesenchymal transition,,,,,,,"A transition where a cardiac epithelial cell loses apical/basolateral polarity, severs intercellular adhesive junctions, degrades basement membrane components and becomes a migratory mesenchymal cell that will contribute to the formation of the endocardial cushion. [GOC:mtg_heart]"
0.0081062,7088,regulation of mitosis,biological process,7346,regulation of mitotic cell cycle,10564,regulation of cell cycle process,51783,regulation of nuclear division,,,"Any process that modulates the frequency, rate or extent of mitosis. [GOC:go_curators]"
0.0081062,7090,regulation of S phase of mitotic cell cycle,biological process,33261,regulation of S phase,2000602,regulation of interphase of mitotic cell cycle,,,,,"A cell cycle process that modulates the frequency, rate or extent of the progression through the S phase of the mitotic cell cycle. [GOC:go_curators]"
0.0081062,7093,mitotic cell cycle checkpoint,biological process,75,cell cycle checkpoint,7346,regulation of mitotic cell cycle,,,,,"A cell cycle checkpoint that ensures accurate chromosome replication and segregation by preventing progression through a mitotic cell cycle until conditions are suitable for the cell to proceed to the next stage. [GOC:mah, GOC:rn, PMID:12360190]"
0.0081062,8156,negative regulation of DNA replication,biological process,6275,regulation of DNA replication,51053,negative regulation of DNA metabolic process,2000113,negative regulation of cellular macromolecule biosynthetic process,,,"Any process that stops, prevents, or reduces the frequency, rate or extent of DNA replication. [GOC:go_curators]"
0.0081062,16331,morphogenesis of embryonic epithelium,biological process,2009,morphogenesis of an epithelium,48598,embryonic morphogenesis,,,,,The process in which the anatomical structures of embryonic epithelia are generated and organized. [GOC:jl]
0.0081062,31503,protein complex localization,biological process,8104,protein localization,,,,,,,"A localization process that acts on a protein complex; the complex is transported to, or maintained in, a specific location. [GOC:mah]"
0.0081062,33160,"positive regulation of protein import into nucleus, translocation",biological process,33158,"regulation of protein import into nucleus, translocation",90316,positive regulation of intracellular protein transport,,,,,"Any process that activates or increases the vectorial transfer of a protein from the cytoplasm into the nucleus, across the nuclear membrane. [GOC:mah]"
0.0081062,35066,positive regulation of histone acetylation,biological process,31058,positive regulation of histone modification,35065,regulation of histone acetylation,2000758,positive regulation of peptidyl-lysine acetylation,,,"Any process that activates or increases the frequency, rate or extent of the addition of an acetyl group to a histone protein. [GOC:bf]"
0.0081062,43967,histone H4 acetylation,biological process,16573,histone acetylation,,,,,,,The modification of histone H4 by the addition of an acetyl group. [GOC:jl]
0.0081062,51256,spindle midzone assembly involved in mitosis,biological process,51255,spindle midzone assembly,,,,,,,"The formation of the spindle midzone, the area in the center of the spindle where the spindle microtubules from opposite poles overlap, as a part of the process of mitosis. [GOC:ai, GOC:expert_rg, GOC:tb]"
0.0081062,51571,positive regulation of histone H3-K4 methylation,biological process,31062,positive regulation of histone methylation,51569,regulation of histone H3-K4 methylation,,,,,"Any process that activates or increases the frequency, rate or extent of the covalent addition of a methyl group to the lysine at position 4 of histone H3. [GOC:mah]"
0.0081062,51573,negative regulation of histone H3-K9 methylation,biological process,31061,negative regulation of histone methylation,51570,regulation of histone H3-K9 methylation,,,,,"Any process that stops, prevents, or reduces the frequency, rate or extent of the covalent addition of a methyl group to the lysine at position 9 of histone H3. [GOC:ai]"
0.0081062,60463,lung lobe morphogenesis,biological process,9653,anatomical structure morphogenesis,,,,,,,The process in which the anatomical structures of a lung lobe are generated and organized. A lung lobe is a projection that extends from the lung. [GOC:dph]
0.0081062,85020,protein K6-linked ubiquitination,biological process,209,protein polyubiquitination,,,,,,,"A protein ubiquitination process in which a polymer of ubiquitin, formed by linkages between lysine residues at position 6 of the ubiquitin monomers, is added to a protein. K6-linked ubiquitination is involved in DNA repair. [GOC:sp]"
0.0097534,1556,oocyte maturation,biological process,3006,developmental process involved in reproduction,48469,cell maturation,48610,cellular process involved in reproduction,,,"A developmental process, independent of morphogenetic (shape) change, that is required for an oocyte to attain its fully functional state. Oocyte maturation commences after reinitiation of meiosis commonly starting with germinal vesicle breakdown, and continues up to the second meiotic arrest prior to fertilization. [GOC:devbiol, http://ovary.stanford.edu]"
0.0097534,10332,response to gamma radiation,biological process,10212,response to ionizing radiation,,,,,,,"Any process that results in a change in state or activity of a cell or an organism (in terms of movement, secretion, enzyme production, gene expression, etc.) as a result of a gamma radiation stimulus. Gamma radiation is a form of electromagnetic radiation (EMR) or light emission of a specific frequency produced from sub-atomic particle interaction, such as electron-positron annihilation and radioactive decay. Gamma rays are generally characterized as EMR having the highest frequency and energy, and also the shortest wavelength, within the electromagnetic radiation spectrum. [GOC:tair_curators, Wikipedia:Gamma_ray]"
0.0097534,48566,embryonic digestive tract development,biological process,48565,digestive tract development,48568,embryonic organ development,,,,,"The process whose specific outcome is the progression of the gut over time, from its formation to the mature structure during embryonic development. The gut is the region of the digestive tract extending from the beginning of the intestines to the anus. [GOC:go_curators]"
0.0097534,90103,cochlea morphogenesis,biological process,48598,embryonic morphogenesis,,,,,,,"The process in which the cochlea is generated and organized. [GOC:dph, GOC:tb]"
0.010637,6461,protein complex assembly,biological process,65003,macromolecular complex assembly,71822,protein complex subunit organization,,,,,"The aggregation, arrangement and bonding together of a set of components to form a protein complex. [GOC:ai]"
0.010637,7368,determination of left/right symmetry,biological process,9855,determination of bilateral symmetry,,,,,,,"The establishment of an organism's body plan or part of an organism with respect to the left and right halves. The pattern can either be symmetric, such that the halves are mirror images, or asymmetric where the pattern deviates from this symmetry. [GOC:dph, GOC:jid]"
0.010637,42325,regulation of phosphorylation,biological process,19220,regulation of phosphate metabolic process,,,,,,,"Any process that modulates the frequency, rate or extent of addition of phosphate groups into a molecule. [GOC:jl]"
0.010693,7126,meiosis,biological process,22403,cell cycle phase,,,,,,,"A cell cycle process comprising the steps by which a cell progresses through the nuclear division phase of a meiotic cell cycle. A meiotic cell cycle is the specialized nuclear and cell division in which a single diploid cell undergoes two nuclear divisions following a single round of DNA replication in order to produce four daughter cells that contain half the number of chromosomes as the diploid cell. Meiotic division occurs during the formation of gametes from diploid organisms and at the beginning of haplophase in those organisms that alternate between diploid and haploid generations. [GOC:dph, GOC:mah, PMID:9334324]"
0.010762,10628,positive regulation of gene expression,biological process,10468,regulation of gene expression,10604,positive regulation of macromolecule metabolic process,,,,,"Any process that increases the frequency, rate or extent of gene expression. Gene expression is the process in which a gene's coding sequence is converted into a mature gene product or products (proteins or RNA). This includes the production of an RNA transcript as well as any processing to produce a mature RNA product or an mRNA (for protein-coding genes) and the translation of that mRNA into protein. Some protein processing events may be included when they are required to form an active form of a product from an inactive precursor form. [GOC:dph, GOC:tb]"
0.012475,45666,positive regulation of neuron differentiation,biological process,45597,positive regulation of cell differentiation,45664,regulation of neuron differentiation,,,,,"Any process that activates or increases the frequency, rate or extent of neuron differentiation. [GOC:go_curators]"
0.013393,6937,regulation of muscle contraction,biological process,90257,regulation of muscle system process,,,,,,,"Any process that modulates the frequency, rate or extent of muscle contraction. [GOC:go_curators]"
0.013393,48754,branching morphogenesis of a tube,biological process,1763,morphogenesis of a branching structure,35239,tube morphogenesis,,,,,"The process in which the anatomical structures of branches in a tube are generated and organized. A tube is a long hollow cylinder. [GOC:dgh, GOC:dph, GOC:jid]"
0.013871,90305,nucleic acid phosphodiester bond hydrolysis,biological process,90304,nucleic acid metabolic process,,,,,,,"The nucleic acid metabolic process in which the phosphodiester bonds between nucleotides are cleaved by hydrolysis. [GOC:dph, GOC:tb]"
0.015646,1779,natural killer cell differentiation,biological process,30098,lymphocyte differentiation,30101,natural killer cell activation,,,,,"The process in which a relatively unspecialized cell acquires the specialized features of a natural killer cell. [GOC:add, ISBN:0781735149]"
0.015646,2326,B cell lineage commitment,biological process,45165,cell fate commitment,,,,,,,"The process in which a lymphoid progenitor cell becomes committed to become any type of B cell. [GOC:add, ISBN:0781735149]"
0.015646,6261,DNA-dependent DNA replication,biological process,6260,DNA replication,,,,,,,"A DNA replication process that uses parental DNA as a template for the DNA-dependent DNA polymerases that synthesize the new strands. [GOC:mah, ISBN:0198506732]"
0.015646,6275,regulation of DNA replication,biological process,51052,regulation of DNA metabolic process,2000112,regulation of cellular macromolecule biosynthetic process,,,,,"Any process that modulates the frequency, rate or extent of DNA replication. [GOC:go_curators]"
0.015646,6707,cholesterol catabolic process,biological process,8203,cholesterol metabolic process,16127,sterol catabolic process,,,,,"The chemical reactions and pathways resulting in the breakdown of cholesterol, cholest-5-en-3 beta-ol, the principal sterol of vertebrates and the precursor of many steroids, including bile acids and steroid hormones. [GOC:ai]"
0.015646,8630,"DNA damage response, signal transduction resulting in induction of apoptosis",biological process,8629,induction of apoptosis by intracellular signals,42770,signal transduction in response to DNA damage,,,,,A cascade of processes initiated by the detection of DNA damage and resulting in the induction of apoptosis (programmed cell death). [GOC:go_curators]
0.015646,9792,embryo development ending in birth or egg hatching,biological process,9790,embryo development,,,,,,,"The process whose specific outcome is the progression of an embryo over time, from zygote formation until the end of the embryonic life stage. The end of the embryonic life stage is organism-specific and may be somewhat arbitrary; for mammals it is usually considered to be birth, for insects the hatching of the first instar larva from the eggshell. [GOC:go_curators, GOC:isa_complete, GOC:mtg_sensu]"
0.015646,10165,response to X-ray,biological process,10212,response to ionizing radiation,,,,,,,"Any process that results in a change in state or activity of a cell or an organism (in terms of movement, secretion, enzyme production, gene expression, etc.) as a result of X-ray radiation. An X-ray is a form of electromagnetic radiation with a wavelength in the range of 10 nanometers to 100 picometers (corresponding to frequencies in the range 30 PHz to 3 EHz). [GOC:sm, Wikipedia:X-ray]"
0.015646,31297,replication fork processing,biological process,6974,response to DNA damage stimulus,45005,maintenance of fidelity involved in DNA-dependent DNA replication,,,,,"The process in which a DNA replication fork that has stalled (due to DNA damage, DNA secondary structure, bound proteins, dNTP shortage, or other causes) is repaired and replication is restarted. [PMID:11459955, PMID:15367656, PMID:17660542]"
0.015646,43518,"negative regulation of DNA damage response, signal transduction by p53 class mediator",biological process,9968,negative regulation of signal transduction,43516,"regulation of DNA damage response, signal transduction by p53 class mediator",2001021,negative regulation of response to DNA damage stimulus,,,"Any process that stops, prevents, or reduces the frequency, rate or extent of the cascade of processes induced by the cell cycle regulator phosphoprotein p53, or an equivalent protein, in response to the detection of DNA damage. [GOC:jl]"
0.015646,51290,protein heterotetramerization,biological process,51262,protein tetramerization,51291,protein heterooligomerization,,,,,"The formation of a protein heterotetramer, a macromolecular structure consisting of four noncovalently associated subunits, of which not all are identical. [GOC:go_curators]"
0.015685,30324,lung development,biological process,48513,organ development,,,,,,,"The process whose specific outcome is the progression of the lung over time, from its formation to the mature structure. In all air-breathing vertebrates the lungs are developed from the ventral wall of the oesophagus as a pouch which divides into two sacs. In amphibians and many reptiles the lungs retain very nearly this primitive sac-like character, but in the higher forms the connection with the esophagus becomes elongated into the windpipe and the inner walls of the sacs become more and more divided, until, in the mammals, the air spaces become minutely divided into tubes ending in small air cells, in the walls of which the blood circulates in a fine network of capillaries. In mammals the lungs are more or less divided into lobes, and each lung occupies a separate cavity in the thorax. [GOC:jid, UBERON:0002048]"
0.017656,7420,brain development,biological process,48513,organ development,,,,,,,"The process whose specific outcome is the progression of the brain over time, from its formation to the mature structure. Brain development begins with patterning events in the neural tube and ends with the mature structure that is the center of thought and emotion. The brain is responsible for the coordination and control of bodily activities and the interpretation of information from the senses (sight, hearing, smell, etc.). [GOC:dph, GOC:jid, GOC:tb, UBERON:0000955]"
0.017704,1932,regulation of protein phosphorylation,biological process,31399,regulation of protein modification process,42325,regulation of phosphorylation,,,,,"Any process that modulates the frequency, rate or extent of addition of phosphate groups into an amino acid in a protein. [GOC:hjd]"
0.017704,6338,chromatin remodeling,biological process,16568,chromatin modification,,,,,,,"Dynamic structural changes to eukaryotic chromatin occurring throughout the cell division cycle. These changes range from the local changes necessary for transcriptional regulation to global changes necessary for chromosome segregation. [GOC:jid, PMID:12697820]"
0.017704,45931,positive regulation of mitotic cell cycle,biological process,7346,regulation of mitotic cell cycle,45787,positive regulation of cell cycle,,,,,"Any process that activates or increases the rate or extent of progression through the mitotic cell cycle. [GOC:dph, GOC:go_curators, GOC:tb]"
0.017704,51145,smooth muscle cell differentiation,biological process,42692,muscle cell differentiation,,,,,,,"The process in which a relatively unspecialized cell acquires specialized features of a smooth muscle cell; smooth muscle lacks transverse striations in its constituent fibers and are almost always involuntary. [CL:0000192, GOC:ai]"
0.019108,1843,neural tube closure,biological process,60606,tube closure,,,,,,,"The last step in the formation of the neural tube, where the paired neural folds are brought together and fuse at the dorsal midline. [GOC:dph, ISBN:0878932437]"
0.019108,43154,negative regulation of cysteine-type endopeptidase activity involved in apoptotic process,biological process,43281,regulation of cysteine-type endopeptidase activity involved in apoptotic process,2000117,negative regulation of cysteine-type endopeptidase activity,,,,,"Any process that stops, prevents, or reduces the frequency, rate or extent of a cysteine-type endopeptidase activity involved in the apoptotic process. [GOC:jl, GOC:mtg_apoptosis]"
0.022695,6865,amino acid transport,biological process,15837,amine transport,46942,carboxylic acid transport,,,,,"The directed movement of amino acids, organic acids containing one or more amino substituents, into, out of or within a cell, or between cells, by means of some agent such as a transporter or pore. [GOC:ai]"
0.022695,30030,cell projection organization,biological process,71842,cellular component organization at cellular level,,,,,,,"A process that is carried out at the cellular level which results in the assembly, arrangement of constituent parts, or disassembly of a prolongation or process extending from a cell, e.g. a flagellum or axon. [GOC:jl, GOC:mah, http://www.cogsci.princeton.edu/~wn/]"
0.025168,6268,DNA unwinding involved in replication,biological process,32508,DNA duplex unwinding,,,,,,,"The process in which interchain hydrogen bonds between two strands of DNA are broken or 'melted', generating unpaired template strands for DNA replication. [ISBN:071673706X, ISBN:0815316194]"
0.025168,6349,regulation of gene expression by genetic imprinting,biological process,40029,"regulation of gene expression, epigenetic",71514,genetic imprinting,,,,,"Heritable alterations in the activity of a gene that depend on whether it passed through the paternal or the maternal germline, but that are not encoded by DNA itself. [GOC:ems, ISBN:0198506732, PMID:11498578]"
0.025168,7019,microtubule depolymerization,biological process,31109,microtubule polymerization or depolymerization,51261,protein depolymerization,,,,,The removal of tubulin heterodimers from one or both ends of a microtubule. [ISBN:0815316194]
0.025168,7062,sister chromatid cohesion,biological process,22402,cell cycle process,51276,chromosome organization,,,,,"The cell cycle process in which the sister chromatids of a replicated chromosome are joined along the entire length of the chromosome. [GOC:mah, ISBN:0815316194]"
0.025168,7128,meiotic prophase I,biological process,51324,prophase,,,,,,,"Prophase occurring as part of meiosis I. Prophase is the part of nuclear division in which, canonically, chromosomes condense and the two daughter centrioles and their asters migrate toward the poles of the cell. Meiosis I is the first phase of meiosis, in which cells divide and homologous chromosomes are paired and segregated from each other. [GOC:dph, GOC:mah]"
0.025168,9165,nucleotide biosynthetic process,biological process,9117,nucleotide metabolic process,34654,nucleobase-containing compound biosynthetic process,,,,,"The chemical reactions and pathways resulting in the formation of nucleotides, any nucleoside that is esterified with (ortho)phosphate or an oligophosphate at any hydroxyl group on the glycose moiety; may be mono-, di- or triphosphate; this definition includes cyclic-nucleotides (nucleoside cyclic phosphates). [GOC:go_curators]"
0.025168,42384,cilium assembly,biological process,10927,cellular component assembly involved in morphogenesis,30031,cell projection assembly,,,,,"The assembly of a cilium, a specialized eukaryotic organelle that consists of a filiform extrusion of the cell surface. Each cilium is bounded by an extrusion of the cytoplasmic membrane, and contains a regular longitudinal array of microtubules, anchored basally in a centriole. [GOC:kmv, ISBN:0198506732]"
0.025168,46632,alpha-beta T cell differentiation,biological process,30217,T cell differentiation,46631,alpha-beta T cell activation,,,,,"The process in which a precursor cell type acquires the specialized features of an alpha-beta T cell. An alpha-beta T cell is a T cell that expresses an alpha-beta T cell receptor complex. [CL:0000789, GOC:ai]"
0.025168,60426,lung vasculature development,biological process,1944,vasculature development,,,,,,,"The biological process whose specific outcome is the progression of a lung vasculature from an initial condition to its mature state. This process begins with the formation of the lung vasculature and ends with the mature structure. The lung vasculature is composed of the tubule structures that carry blood or lymph in the lungs. [GOC:dph, GOC:mtg_lung]"
0.025168,60766,negative regulation of androgen receptor signaling pathway,biological process,33144,negative regulation of intracellular steroid hormone receptor signaling pathway,60765,regulation of androgen receptor signaling pathway,,,,,"Any process that decreases the rate, frequency, or extent of the androgen receptor signaling pathway. [GOC:dph]"
0.025168,71158,positive regulation of cell cycle arrest,biological process,71156,regulation of cell cycle arrest,90068,positive regulation of cell cycle process,,,,,"Any process that increases the rate, frequency, or extent of cell cycle arrest, the process in which the cell cycle is halted during one of the normal phases. [GOC:mah]"
0.026553,82,G1/S transition of mitotic cell cycle,biological process,22402,cell cycle process,,,,,,,Progression from G1 phase to S phase of the mitotic cell cycle. [GOC:mah]
0.027232,50790,regulation of catalytic activity,biological process,19222,regulation of metabolic process,65009,regulation of molecular function,,,,,Any process that modulates the activity of an enzyme. [GOC:ai]
0.02837,79,regulation of cyclin-dependent protein kinase activity,biological process,51726,regulation of cell cycle,71900,regulation of protein serine/threonine kinase activity,,,,,"Any process that modulates the frequency, rate or extent of CDK activity. [GOC:go_curators]"
0.02837,18105,peptidyl-serine phosphorylation,biological process,6468,protein phosphorylation,18209,peptidyl-serine modification,,,,,The phosphorylation of peptidyl-serine to form peptidyl-O-phospho-L-serine. [RESID:AA0037]
0.030841,51091,positive regulation of sequence-specific DNA binding transcription factor activity,biological process,44093,positive regulation of molecular function,51090,regulation of sequence-specific DNA binding transcription factor activity,,,,,"Any process that activates or increases the frequency, rate or extent of activity of a transcription factor, any factor involved in the initiation or regulation of transcription. [GOC:ai]"
0.034724,3333,amino acid transmembrane transport,biological process,6865,amino acid transport,55085,transmembrane transport,,,,,"The directed movement of amino acids, organic acids containing one or more amino substituents across a membrane by means of some agent such as a transporter or pore. [GOC:dph, GOC:tb]"
0.034724,33077,T cell differentiation in thymus,biological process,30217,T cell differentiation,,,,,,,"The process in which a precursor cell type acquires the specialized features of a T cell via a differentiation pathway dependent upon transit through the thymus. [GOC:add, ISBN:0781735149]"
0.034724,45840,positive regulation of mitosis,biological process,7088,regulation of mitosis,45787,positive regulation of cell cycle,51785,positive regulation of nuclear division,90068,positive regulation of cell cycle process,"Any process that activates or increases the frequency, rate or extent of mitosis. [GOC:go_curators]"
0.034724,50728,negative regulation of inflammatory response,biological process,31348,negative regulation of defense response,32102,negative regulation of response to external stimulus,50727,regulation of inflammatory response,,,"Any process that stops, prevents, or reduces the frequency, rate or extent of the inflammatory response. [GOC:ai]"
0.036444,60,"protein import into nucleus, translocation",biological process,6886,intracellular protein transport,,,,,,,"A protein transport process that contributes to protein import into the nucleus, and that results in the vectorial transfer of a cargo-carrier protein complex through the nuclear pore complex from the cytoplasmic side to the nucleoplasmic side of the nuclear envelope. [GOC:curators, ISBN:0198506732, PMID:14570049, PMID:9126736]"
