som_mouse_1_1,,,,,,,,,,,,
0.023054,51899,membrane depolarization,biological process,42391,regulation of membrane potential,,,,,,,"The process in which membrane potential changes in the depolarizing direction from the resting potential, usually from negative to positive. For example, the initial depolarization during the rising phase of an action potential is in the direction from the negative resting potential towards the positive membrane potential that will be the peak of the action potential. [Wikipedia:Depolarization]"
0.02346,30335,positive regulation of cell migration,biological process,30334,regulation of cell migration,2000147,positive regulation of cell motility,,,,,"Any process that activates or increases the frequency, rate or extent of cell migration. [GOC:go_curators]"
0.03097,9968,negative regulation of signal transduction,biological process,9966,regulation of signal transduction,10648,negative regulation of cell communication,23057,negative regulation of signaling,48585,negative regulation of response to stimulus,"Any process that stops, prevents, or reduces the frequency, rate or extent of signal transduction. [GOC:sm]"
0.03982,1764,neuron migration,biological process,16477,cell migration,,,,,,,The characteristic movement of an immature neuron from germinal zones to specific positions where they will reside as they mature. [GOC:go_curators]
0.04452,30334,regulation of cell migration,biological process,2000145,regulation of cell motility,,,,,,,"Any process that modulates the frequency, rate or extent of cell migration. [GOC:go_curators]"
0.048209,7166,cell surface receptor signaling pathway,biological process,7165,signal transduction,,,,,,,"A series of molecular signals initiated by activation of a receptor on the surface of a cell. The pathway begins with binding of an extracellular ligand to a cell surface receptor, or for receptors that signal in the absence of a ligand, by ligand-withdrawal or the activity of a constitutively active receptor. The pathway ends with regulation of a downstream cellular process, e.g. transcription. [GOC:bf, GOC:mah, GOC:pr, GOC:signaling]"
0.049442,30336,negative regulation of cell migration,biological process,30334,regulation of cell migration,2000146,negative regulation of cell motility,,,,,"Any process that stops, prevents, or reduces the frequency, rate or extent of cell migration. [GOC:go_curators]"
som_mouse_5_2,,,,,,,,,,,,
p-value,GO ID,Name,Type,Is a,,Is a,,Is a,,,,Description
0.00023419,43967,histone H4 acetylation,biological process,16573,histone acetylation,,,,,,,The modification of histone H4 by the addition of an acetyl group. [GOC:jl]
0.00077171,1837,epithelial to mesenchymal transition,biological process,904,cell morphogenesis involved in differentiation,,,,,,,"A transition where an epithelial cell loses apical/basolateral polarity, severs intercellular adhesive junctions, degrades basement membrane components and becomes a migratory mesenchymal cell. [GOC:dph, PMID:14701881]"
0.00092343,30036,actin cytoskeleton organization,biological process,7010,cytoskeleton organization,30029,actin filament-based process,,,,,"A process that is carried out at the cellular level which results in the assembly, arrangement of constituent parts, or disassembly of cytoskeletal structures comprising actin filaments and their associated proteins. [GOC:dph, GOC:jl, GOC:mah]"
0.0011509,43966,histone H3 acetylation,biological process,16573,histone acetylation,,,,,,,The modification of histone H3 by the addition of an acetyl group. [GOC:jl]
0.0016021,2076,osteoblast development,biological process,48468,cell development,,,,,,,"The process whose specific outcome is the progression of an osteoblast over time, from its formation to the mature structure. Osteoblast development does not include the steps involved in committing a cranial neural crest cell or an osteoprogenitor cell to an osteoblast fate. An osteoblast is a cell that gives rise to bone. [GOC:dph]"
0.0020963,8360,regulation of cell shape,biological process,22604,regulation of cell morphogenesis,65008,regulation of biological quality,,,,,"Any process that modulates the surface configuration of a cell. [GOC:dph, GOC:go_curators, GOC:tb]"
0.0021239,7193,inhibition of adenylate cyclase activity by G-protein signaling pathway,biological process,7188,"G-protein signaling, coupled to cAMP nucleotide second messenger",7194,negative regulation of adenylate cyclase activity,,,,,"The series of molecular signals generated as a consequence of a G-protein coupled receptor binding to its physiological ligand, followed by inhibition of adenylyl cyclase and a subsequent decrease in the concentration of cyclic AMP. [GOC:dph, GOC:mah, GOC:tb, ISBN:0815316194]"
0.0021239,51017,actin filament bundle assembly,biological process,7015,actin filament organization,71844,cellular component assembly at cellular level,,,,,The assembly of actin filament bundles; actin filaments are on the same axis but may be oriented with the same or opposite polarities and may be packed with different levels of tightness. [GOC:ai]
0.0033744,30513,positive regulation of BMP signaling pathway,biological process,30510,regulation of BMP signaling pathway,90100,positive regulation of transmembrane receptor protein serine/threonine kinase signaling pathway,,,,,"Any process that activates or increases the frequency, rate or extent of BMP signaling pathway activity. [GOC:go_curators]"
0.0033744,48468,cell development,biological process,48856,anatomical structure development,48869,cellular developmental process,,,,,"The process whose specific outcome is the progression of the cell over time, from its formation to the mature structure. Cell development does not include the steps involved in committing a cell to a specific fate. [GOC:go_curators]"
0.01096,2009,morphogenesis of an epithelium,biological process,48729,tissue morphogenesis,,,,,,,"The process in which the anatomical structures of epithelia are generated and organized. An epithelium consists of closely packed cells arranged in one or more layers, that covers the outer surfaces of the body or lines any internal cavity or tube. [GOC:dph, GOC:jl, GOC:tb, ISBN:0198506732]"
0.01218,8380,RNA splicing,biological process,6396,RNA processing,,,,,,,"The process of removing sections of the primary RNA transcript to remove sequences not present in the mature form of the RNA and joining the remaining sections to form the mature form of the RNA. [GOC:krc, GOC:mah]"
0.014755,10628,positive regulation of gene expression,biological process,10468,regulation of gene expression,10604,positive regulation of macromolecule metabolic process,,,,,"Any process that increases the frequency, rate or extent of gene expression. Gene expression is the process in which a gene's coding sequence is converted into a mature gene product or products (proteins or RNA). This includes the production of an RNA transcript as well as any processing to produce a mature RNA product or an mRNA (for protein-coding genes) and the translation of that mRNA into protein. Some protein processing events may be included when they are required to form an active form of a product from an inactive precursor form. [GOC:dph, GOC:tb]"
0.014788,48704,embryonic skeletal system morphogenesis,biological process,48562,embryonic organ morphogenesis,48705,skeletal system morphogenesis,,,,,"The process in which the anatomical structures of the skeleton are generated and organized during the embryonic phase. [GOC:dph, GOC:dsf, GOC:jid, GOC:tb, PMID:16049113]"
0.016174,60021,palate development,biological process,48856,anatomical structure development,,,,,,,"The biological process whose specific outcome is the progression of the palate from an initial condition to its mature state. This process begins with the formation of the structure and ends with the mature structure. The palate is the partition that separates the nasal and oral cavities. [GOC:dph, ISBN:0721662544]"
0.017614,90090,negative regulation of canonical Wnt receptor signaling pathway,biological process,30178,negative regulation of Wnt receptor signaling pathway,60828,regulation of canonical Wnt receptor signaling pathway,,,,,"Any process that decreases the rate, frequency, or extent of the Wnt receptor signaling pathway through beta-catenin, the series of molecular signals initiated by binding of a Wnt protein to a frizzled family receptor on the surface of the target cell, followed by propagation of the signal via beta-catenin, and ending with a change in transcription of target genes. [GOC:dph, GOC:tb]"
0.022245,6897,endocytosis,biological process,16192,vesicle-mediated transport,,,,,,,"A vesicle-mediated transport process in which cells take up external materials or membrane constituents by the invagination of a small region of the plasma membrane to form a new membrane-bounded vesicle. [GOC:mah, ISBN:0198506732, ISBN:0716731363]"
0.023888,7010,cytoskeleton organization,biological process,6996,organelle organization,,,,,,,"A process that is carried out at the cellular level which results in the assembly, arrangement of constituent parts, or disassembly of cytoskeletal structures. [GOC:dph, GOC:jl, GOC:mah]"
0.023888,45666,positive regulation of neuron differentiation,biological process,45597,positive regulation of cell differentiation,45664,regulation of neuron differentiation,,,,,"Any process that activates or increases the frequency, rate or extent of neuron differentiation. [GOC:go_curators]"
0.029106,7156,homophilic cell adhesion,biological process,16337,cell-cell adhesion,,,,,,,The attachment of an adhesion molecule in one cell to an identical molecule in an adjacent cell. [ISBN:0198506732]
0.029106,16337,cell-cell adhesion,biological process,7155,cell adhesion,,,,,,,The attachment of one cell to another cell via adhesion molecules. [GOC:hb]
0.029106,51726,regulation of cell cycle,biological process,50794,regulation of cellular process,,,,,,,"Any process that modulates the rate or extent of progression through the cell cycle. [GOC:ai, GOC:dph, GOC:tb]"
0.030938,7154,cell communication,biological process,9987,cellular process,,,,,,,"Any process that mediates interactions between a cell and its surroundings. Encompasses interactions such as signaling or attachment between one cell and another cell, between a cell and an extracellular matrix, or between a cell and any other aspect of its environment. [GOC:mah]"
0.04496,1764,neuron migration,biological process,16477,cell migration,,,,,,,The characteristic movement of an immature neuron from germinal zones to specific positions where they will reside as they mature. [GOC:go_curators]
som_mouse_5_3,,,,,,,,,,,,
p-value,GO ID,Name,Type,Is a,,Is a,,Is a,,,,Description
6.60E-05,6260,DNA replication,biological process,6259,DNA metabolic process,34645,cellular macromolecule biosynthetic process,,,,,"The cellular metabolic process in which a cell duplicates one or more molecules of DNA. DNA replication begins when specific sequences, known as origins of replication, are recognized and bound by initiation proteins, and ends when the original DNA molecule has been completely duplicated and the copies topologically separated. The unit of replication usually corresponds to the genome of the cell, an organelle, or a virus. The template for replication can either be an existing DNA molecule or RNA. [GOC:mah]"
0.00019869,43488,regulation of mRNA stability,biological process,43487,regulation of RNA stability,,,,,,,Any process that modulates the propensity of mRNA molecules to degradation. Includes processes that both stabilize and destabilize mRNAs. [GOC:jl]
0.0010761,6417,regulation of translation,biological process,10608,posttranscriptional regulation of gene expression,32268,regulation of cellular protein metabolic process,2000112,regulation of cellular macromolecule biosynthetic process,,,"Any process that modulates the frequency, rate or extent of the chemical reactions and pathways resulting in the formation of proteins by the translation of mRNA. [GOC:isa_complete]"
0.0013827,6346,methylation-dependent chromatin silencing,biological process,6342,chromatin silencing,16569,covalent chromatin modification,,,,,"Repression of transcription by methylation of DNA, leading to the formation of heterochromatin. [GOC:mah]"
0.0040458,51571,positive regulation of histone H3-K4 methylation,biological process,31062,positive regulation of histone methylation,51569,regulation of histone H3-K4 methylation,,,,,"Any process that activates or increases the frequency, rate or extent of the covalent addition of a methyl group to the lysine at position 4 of histone H3. [GOC:mah]"
0.007893,6306,DNA methylation,biological process,6305,DNA alkylation,40029,"regulation of gene expression, epigenetic",43414,macromolecule methylation,,,"The covalent transfer of a methyl group to either N-6 of adenine or C-5 or N-4 of cytosine. [GOC:ems, ISBN:0198506732]"
0.007893,48384,retinoic acid receptor signaling pathway,biological process,30522,intracellular receptor mediated signaling pathway,,,,,,,The series of molecular signals generated as a consequence of a retinoic acid receptor binding to one of its physiological ligands. [GOC:dgh]
0.0087526,45454,cell redox homeostasis,biological process,19725,cellular homeostasis,50794,regulation of cellular process,,,,,"Any process that maintains the redox environment of a cell or compartment within a cell. [GOC:ai, GOC:dph, GOC:tb]"
0.0087526,48666,neuron development,biological process,48468,cell development,,,,,,,"The process whose specific outcome is the progression of a neuron over time, from initial commitment of the cell to a specific fate, to the fully functional differentiated cell. [GOC:dph]"
0.012833,6268,DNA unwinding involved in replication,biological process,32508,DNA duplex unwinding,,,,,,,"The process in which interchain hydrogen bonds between two strands of DNA are broken or 'melted', generating unpaired template strands for DNA replication. [ISBN:071673706X, ISBN:0815316194]"
0.012833,9165,nucleotide biosynthetic process,biological process,9117,nucleotide metabolic process,34654,nucleobase-containing compound biosynthetic process,,,,,"The chemical reactions and pathways resulting in the formation of nucleotides, any nucleoside that is esterified with (ortho)phosphate or an oligophosphate at any hydroxyl group on the glycose moiety; may be mono-, di- or triphosphate; this definition includes cyclic-nucleotides (nucleoside cyclic phosphates). [GOC:go_curators]"
0.012833,30194,positive regulation of blood coagulation,biological process,30193,regulation of blood coagulation,50820,positive regulation of coagulation,1900048,positive regulation of hemostasis,,,"Any process that activates or increases the frequency, rate or extent of blood coagulation. [GOC:mah]"
0.012833,30903,notochord development,biological process,48568,embryonic organ development,,,,,,,"The process whose specific outcome is the progression of the notochord over time, from its formation to the mature structure. The notochord is a mesoderm-derived structure located ventral of the developing nerve cord. In vertebrates, the notochord serves as a core around which other mesodermal cells form the vertebrae. In the most primitive chordates, which lack vertebrae, the notochord persists as a substitute for a vertebral column. [GOC:dgh]"
0.012833,34612,response to tumor necrosis factor,biological process,34097,response to cytokine stimulus,,,,,,,"Any process that results in a change in state or activity of a cell or an organism (in terms of movement, secretion, enzyme production, gene expression, etc.) as a result of a tumor necrosis factor stimulus. [GOC:mah]"
0.01667,43525,positive regulation of neuron apoptotic process,biological process,43065,positive regulation of apoptotic process,43523,regulation of neuron apoptotic process,,,,,"Any process that activates or increases the frequency, rate or extent of cell death of neurons by apoptosis. [GOC:go_curators]"
0.01878,30099,myeloid cell differentiation,biological process,30154,cell differentiation,,,,,,,"The process in which a relatively unspecialized myeloid precursor cell acquires the specialized features of any cell of the myeloid leukocyte, megakaryocyte, thrombocyte, or erythrocyte lineages. [GOC:add, ISBN:0781735149]"
0.01878,32436,positive regulation of proteasomal ubiquitin-dependent protein catabolic process,biological process,31331,positive regulation of cellular catabolic process,32434,regulation of proteasomal ubiquitin-dependent protein catabolic process,45732,positive regulation of protein catabolic process,45862,positive regulation of proteolysis,"Any process that activates or increases the frequency, rate or extent of the breakdown of a protein or peptide by hydrolysis of its peptide bonds, initiated by the covalent attachment of ubiquitin, and mediated by the proteasome. [GOC:mah]"
0.01878,42771,"DNA damage response, signal transduction by p53 class mediator resulting in induction of apoptosis",biological process,8630,"DNA damage response, signal transduction resulting in induction of apoptosis",30330,"DNA damage response, signal transduction by p53 class mediator",72332,signal transduction by p53 class mediator resulting in induction of apoptosis,,,"A cascade of processes induced by the cell cycle regulator phosphoprotein p53, or an equivalent protein, in response to the detection of DNA damage and resulting in the initiation of apoptosis (programmed cell death). [GOC:go_curators]"
0.01878,71777,positive regulation of cell cycle cytokinesis,biological process,32467,positive regulation of cytokinesis,71775,regulation of cell cycle cytokinesis,90068,positive regulation of cell cycle process,,,"Any process that activates or increases the frequency, rate or extent of the division of the cytoplasm of a cell, and its separation into two daughter cells, that occurs in the context of cell cycle progression. [GOC:mah]"
0.02145,30182,neuron differentiation,biological process,30154,cell differentiation,,,,,,,The process in which a relatively unspecialized cell acquires specialized features of a neuron. [GOC:mah]
0.025652,6270,DNA-dependent DNA replication initiation,biological process,6259,DNA metabolic process,,,,,,,"The process in which DNA replication is started; this involves the separation of a stretch of the DNA double helix, the recruitment of DNA polymerases and the initiation of polymerase action. [ISBN:071673706X, ISBN:0815316194]"
0.025652,6977,"DNA damage response, signal transduction by p53 class mediator resulting in cell cycle arrest",biological process,30330,"DNA damage response, signal transduction by p53 class mediator",71158,positive regulation of cell cycle arrest,72431,signal transduction involved in mitotic cell cycle G1/S transition DNA damage checkpoint,,,"A cascade of processes induced by the cell cycle regulator phosphoprotein p53, or an equivalent protein, in response to the detection of DNA damage and resulting in the stopping or reduction in rate of the cell cycle. [GOC:go_curators]"
0.025652,10212,response to ionizing radiation,biological process,9314,response to radiation,,,,,,,"Any process that results in a change in state or activity of a cell or an organism (in terms of movement, secretion, enzyme production, gene expression, etc.) as a result of a ionizing radiation stimulus. Ionizing radiation is radiation with sufficient energy to remove electrons from atoms and may arise from spontaneous decay of unstable isotopes, resulting in alpha and beta particles and gamma rays. Ionizing radiation also includes X-rays. [PMID:12509526]"
0.033373,1508,regulation of action potential,biological process,42391,regulation of membrane potential,,,,,,,"Any process that modulates the frequency, rate or extent of action potential creation, propagation or termination. An action potential is a spike of membrane depolarization and repolarization that travels along the membrane of a cell. [GOC:dph, GOC:go_curators, GOC:tb]"
0.033373,1676,long-chain fatty acid metabolic process,biological process,6631,fatty acid metabolic process,,,,,,,"The chemical reactions and pathways involving long-chain fatty acids, any fatty acid with a chain length of C13 or more. This includes very long-chain fatty acids, which have a chain length of greater than C18. [CHEBI:15904, GOC:ajp]"
0.036449,1843,neural tube closure,biological process,60606,tube closure,,,,,,,"The last step in the formation of the neural tube, where the paired neural folds are brought together and fuse at the dorsal midline. [GOC:dph, ISBN:0878932437]"
0.041387,6310,DNA recombination,biological process,6259,DNA metabolic process,,,,,,,"Any process in which a new genotype is formed by reassortment of genes resulting in gene combinations different from those that were present in the parents. In eukaryotes genetic recombination can occur by chromosome assortment, intrachromosomal recombination, or nonreciprocal interchromosomal recombination. Intrachromosomal recombination occurs by crossing over. In bacteria it may occur by genetic transformation, conjugation, transduction, or F-duction. [ISBN:0198506732]"
0.041871,7569,cell aging,biological process,7568,aging,9987,cellular process,,,,,"An aging process that has as participant a cell after a cell has stopped dividing.  Cell aging may occur when a cell has temporarily stopped dividing through cell cycle arrest  (GO:0007050) or when a cell has permanently stopped dividing, in which case it is undergoing cellular senescence (GO:0090398). May precede cell death (GO:0008219) and succeed cell maturation (GO:0048469). [GOC:PO_curators]"
0.041871,10001,glial cell differentiation,biological process,30154,cell differentiation,,,,,,,"The process in which a relatively unspecialized cell acquires the specialized features of a glial cell. [GOC:go_curators, GOC:mtg_sensu]"
0.041871,23019,signal transduction involved in regulation of gene expression,biological process,7165,signal transduction,,,,,,,"Any process that modulates the frequency, rate or extent of gene expression as a consequence of a process in which a signal is released and/or conveyed from one location to another. [GOC:mtg_signal]"
som_mouse_5_4,,,,,,,,,,,,
p-value,GO ID,Name,Type,Is a,,Is a,,Is a,,,,Description
0.00097773,48514,blood vessel morphogenesis,biological process,9653,anatomical structure morphogenesis,,,,,,,The process in which the anatomical structures of blood vessels are generated and organized. The blood vessel is the vasculature carrying blood. [GOC:jid]
0.00098515,3338,metanephros morphogenesis,biological process,60993,kidney morphogenesis,,,,,,,"The process in which the anatomical structures of the metanephros are generated and organized. [GOC:dph, GOC:yaf]"
0.00098515,60428,lung epithelium development,biological process,60429,epithelium development,,,,,,,"The biological process whose specific outcome is the progression of the lung epithelium from an initial condition to its mature state. This process begins with the formation of lung epithelium and ends with the mature structure. The lung epithelium is the specialized epithelium that lines the inside of the lung. [GOC:dph, GOC:mtg_lung]"
0.0016103,9952,anterior/posterior pattern specification,biological process,3002,regionalization,,,,,,,"The regionalization process in which specific areas of cell differentiation are determined along the anterior-posterior axis. The anterior-posterior axis is defined by a line that runs from the head or mouth of an organism to the tail or opposite end of the organism. [GOC:dph, GOC:go_curators, GOC:isa_complete, GOC:tb]"
0.0028941,10596,negative regulation of endothelial cell migration,biological process,10594,regulation of endothelial cell migration,30336,negative regulation of cell migration,,,,,"Any process that decreases the rate, frequency, or extent of the orderly movement of an endothelial cell into the extracellular matrix to form an endothelium. [GOC:BHF, GOC:dph, GOC:tb]"
0.0028941,30949,positive regulation of vascular endothelial growth factor receptor signaling pathway,biological process,9967,positive regulation of signal transduction,30947,regulation of vascular endothelial growth factor receptor signaling pathway,,,,,"Any process that activates or increases the frequency, rate or extent of vascular endothelial growth factor receptor signaling pathway activity. [GOC:dgh]"
0.0028941,2000096,"positive regulation of Wnt receptor signaling pathway, planar cell polarity pathway",biological process,2000052,positive regulation of non-canonical Wnt receptor signaling pathway,2000095,"regulation of Wnt receptor signaling pathway, planar cell polarity pathway",,,,,"Any process that activates or increases the frequency, rate or extent of Wnt receptor signaling pathway, planar cell polarity pathway. [GOC:BHF]"
0.0044534,43401,steroid hormone mediated signaling pathway,biological process,9755,hormone-mediated signaling pathway,71383,cellular response to steroid hormone stimulus,,,,,A series of molecular signals mediated by a steroid hormone binding to a receptor. [PMID:12606724]
0.0056683,48384,retinoic acid receptor signaling pathway,biological process,30522,intracellular receptor mediated signaling pathway,,,,,,,The series of molecular signals generated as a consequence of a retinoic acid receptor binding to one of its physiological ligands. [GOC:dgh]
0.0092519,42535,positive regulation of tumor necrosis factor biosynthetic process,biological process,42108,positive regulation of cytokine biosynthetic process,42534,regulation of tumor necrosis factor biosynthetic process,,,,,"Any process that activates or increases the frequency, rate or extent of the chemical reactions and pathways resulting in the formation of tumor necrosis factor, an inflammatory cytokine produced by macrophages/monocytes during acute inflammation and which is responsible for a diverse range of signaling events within cells, leading to necrosis or apoptosis. [GOC:jl, PMID:10891884]"
