som_mouse_1_1,,,,,,,,,,,,
0.038226,30856,regulation of epithelial cell differentiation,biological process,45595,regulation of cell differentiation,2000026,regulation of multicellular organismal development,,,,,"Any process that modulates the frequency, rate or extent of epithelial cell differentiation. [GOC:mah]"
0.038226,45475,locomotor rhythm,biological process,7626,locomotory behavior,48512,circadian behavior,,,,,The rhythm of the locomotor activity of an organism during its 24 hour activity cycle. [GOC:go_curators]
0.038226,45651,positive regulation of macrophage differentiation,biological process,2763,positive regulation of myeloid leukocyte differentiation,45649,regulation of macrophage differentiation,,,,,"Any process that activates or increases the frequency, rate or extent of macrophage differentiation. [GOC:go_curators]"
0.038226,51461,positive regulation of corticotropin secretion,biological process,46887,positive regulation of hormone secretion,51459,regulation of corticotropin secretion,,,,,"Any process that activates or increases the frequency, rate or extent of the regulated release of corticotropin hormone from a cell or group of cells. [GOC:ai]"
0.038226,71276,cellular response to cadmium ion,biological process,46686,response to cadmium ion,71248,cellular response to metal ion,,,,,"Any process that results in a change in state or activity of a cell (in terms of movement, secretion, enzyme production, gene expression, etc.) as a result of a cadmium (Cd) ion stimulus. [GOC:mah]"
0.040654,70482,response to oxygen levels,biological process,42221,response to chemical stimulus,,,,,,,"Any process that results in a change in state or activity of a cell or an organism (in terms of movement, secretion, enzyme production, gene expression, etc.) as a result of a stimulus reflecting the presence, absence, or concentration of oxygen. [GOC:BHF, GOC:mah]"
0.046124,17144,drug metabolic process,biological process,44237,cellular metabolic process,,,,,,,"The chemical reactions and pathways involving a drug, a substance used in the diagnosis, treatment or prevention of a disease; as used here antibiotic substances (see antibiotic metabolism) are considered to be drugs, even if not used in medical or veterinary practice. [GOC:cab2]"
0.046124,31424,keratinization,biological process,32502,developmental process,,,,,,,"The process in which the cytoplasm of the outermost cells of the vertebrate epidermis is replaced by keratin. Keratinization occurs in the stratum corneum, feathers, hair, claws, nails, hooves, and horns. [GOC:dph, GOC:ebc, GOC:sdb_2009, GOC:tb]"
0.046124,35458,cellular response to interferon-beta,biological process,35456,response to interferon-beta,71345,cellular response to cytokine stimulus,,,,,"Any process that results in a change in state or activity of a cell (in terms of movement, secretion, enzyme production, gene expression, etc.) as a result of an interferon-beta stimulus. Interferon-beta is a type I interferon. [GOC:sl]"
som_mouse_3_1,,,,,,,,,,,,
p-value,GO ID,Name,Type,Is a,,Is a,,Is a,,,,Description
2.32E-05,9086,methionine biosynthetic process,biological process,97,sulfur amino acid biosynthetic process,6555,methionine metabolic process,9067,aspartate family amino acid biosynthetic process,,,"The chemical reactions and pathways resulting in the formation of methionine (2-amino-4-(methylthio)butanoic acid), a sulfur-containing, essential amino acid found in peptide linkage in proteins. [GOC:jl, ISBN:0198506732]"
0.00016032,48705,skeletal system morphogenesis,biological process,9887,organ morphogenesis,,,,,,,"The process in which the anatomical structures of the skeleton are generated and organized. [GOC:dph, GOC:dsf, GOC:jid, GOC:tb]"
0.0019268,42490,mechanoreceptor differentiation,biological process,30182,neuron differentiation,,,,,,,"The process in which a relatively unspecialized cell acquires specialized features of a mechanoreceptor, a cell specialized to transduce mechanical stimuli and relay that information centrally in the nervous system. [CL:0000199, GOC:jl]"
0.0065064,48167,regulation of synaptic plasticity,biological process,50804,regulation of synaptic transmission,65008,regulation of biological quality,,,,,"A process that modulates synaptic plasticity, the ability of synapses to change as circumstances require. They may alter function, such as increasing or decreasing their sensitivity, or they may increase or decrease in actual numbers. [GOC:dph, GOC:jid, GOC:tb, http://www.mercksource.com, PMID:11891290]"
0.010964,42493,response to drug,biological process,42221,response to chemical stimulus,,,,,,,"Any process that results in a change in state or activity of a cell or an organism (in terms of movement, secretion, enzyme production, gene expression, etc.) as a result of a drug stimulus. A drug is a substance used in the diagnosis, treatment or prevention of a disease. [GOC:jl]"
0.013453,35108,limb morphogenesis,biological process,35107,appendage morphogenesis,,,,,,,"The process in which the anatomical structures of a limb are generated and organized. A limb is an appendage of an animal used for locomotion or grasping. Examples include legs, arms or some types of fin. [ISBN:0395825172]"
0.015399,1525,angiogenesis,biological process,48646,anatomical structure formation involved in morphogenesis,,,,,,,Blood vessel formation when new vessels emerge from the proliferation of pre-existing blood vessels. [ISBN:0878932453]
0.019269,60325,face morphogenesis,biological process,9653,anatomical structure morphogenesis,,,,,,,The process in which the anatomical structures of the face are generated and organized. The face is the ventral division of the head. [GOC:dph]
0.025947,8344,adult locomotory behavior,biological process,7626,locomotory behavior,30534,adult behavior,,,,,Locomotory behavior in a fully developed and mature organism. [GOC:ai]
0.041619,51607,defense response to virus,biological process,2252,immune effector process,6952,defense response,9615,response to virus,,,Reactions triggered in response to the presence of a virus that act to protect the cell or organism. [GOC:ai]
0.045973,9791,post-embryonic development,biological process,32502,developmental process,,,,,,,"The process whose specific outcome is the progression of the organism over time, from the completion of embryonic development to the mature structure. See embryonic development. [GOC:go_curators]"
som_mouse_3_2,,,,,,,,,,,,
p-value,GO ID,Name,Type,Is a,,Is a,,Is a,,,,Description
0.0011793,42119,neutrophil activation,biological process,2274,myeloid leukocyte activation,,,,,,,"The change in morphology and behavior of a neutrophil resulting from exposure to a cytokine, chemokine, cellular ligand, or soluble factor. [GOC:mgi_curators, ISBN:0781735149]"
0.0038286,6364,rRNA processing,biological process,16072,rRNA metabolic process,34470,ncRNA processing,,,,,Any process involved in the conversion of a primary ribosomal RNA (rRNA) transcript into one or more mature rRNA molecules. [GOC:curators]
0.0038286,10862,positive regulation of pathway-restricted SMAD protein phosphorylation,biological process,1934,positive regulation of protein phosphorylation,60393,regulation of pathway-restricted SMAD protein phosphorylation,90100,positive regulation of transmembrane receptor protein serine/threonine kinase signaling pathway,,,"Any process that increases the rate, frequency or extent of pathway-restricted SMAD protein phosphorylation. Pathway-restricted SMAD proteins and common-partner SMAD proteins are involved in the transforming growth factor beta receptor signaling pathways. [GOC:dph, GOC:tb]"
0.0078313,19433,triglyceride catabolic process,biological process,6641,triglyceride metabolic process,46464,acylglycerol catabolic process,,,,,"The chemical reactions and pathways resulting in the breakdown of a triglyceride, any triester of glycerol. [ISBN:0198506732]"
0.0388,6955,immune response,biological process,2376,immune system process,50896,response to stimulus,,,,,"Any immune system process that functions in the calibrated response of an organism to a potential internal or invasive threat. [GO_REF:0000022, GOC:add, GOC:mtg_15nov05]"
0.04452,42102,positive regulation of T cell proliferation,biological process,42129,regulation of T cell proliferation,50671,positive regulation of lymphocyte proliferation,50870,positive regulation of T cell activation,,,Any process that activates or increases the rate or extent of T cell proliferation. [GOC:ai]
som_mouse_3_3,,,,,,,,,,,,
p-value,GO ID,Name,Type,Is a,,Is a,,Is a,,,,Description
0.00095515,32735,positive regulation of interleukin-12 production,biological process,1819,positive regulation of cytokine production,32655,regulation of interleukin-12 production,,,,,"Any process that activates or increases the frequency, rate, or extent of interleukin-12 production. [GOC:mah]"
0.0020902,19236,response to pheromone,biological process,10033,response to organic substance,,,,,,,"Any process that results in a change in state or activity of a cell or an organism (in terms of movement, secretion, enzyme production, gene expression, etc.) as a result of a pheromone stimulus. [GOC:jl]"
0.0038562,7606,sensory perception of chemical stimulus,biological process,7600,sensory perception,,,,,,,"The series of events required for an organism to receive a sensory chemical stimulus, convert it to a molecular signal, and recognize and characterize the signal. This is a neurological process. [GOC:ai]"
0.0041193,60577,pulmonary vein morphogenesis,biological process,48845,venous blood vessel morphogenesis,,,,,,,The process in which the anatomical structure of the pulmonary venous blood vessels are generated and organized. Pulmonary veins are blood vessels that transport blood from the lungs to the heart. [GOC:dph]
0.0054943,45785,positive regulation of cell adhesion,biological process,30155,regulation of cell adhesion,48522,positive regulation of cellular process,,,,,"Any process that activates or increases the frequency, rate or extent of cell adhesion. [GOC:go_curators]"
0.011564,32733,positive regulation of interleukin-10 production,biological process,1819,positive regulation of cytokine production,32653,regulation of interleukin-10 production,,,,,"Any process that activates or increases the frequency, rate, or extent of interleukin-10 production. [GOC:mah]"
0.011831,34393,positive regulation of smooth muscle cell apoptotic process,biological process,10661,positive regulation of muscle cell apoptotic process,34391,regulation of smooth muscle cell apoptotic process,,,,,"Any process that activates or increases the frequency, rate, or extent of smooth muscle cell apoptosis. [GOC:BHF, GOC:rl]"
0.011831,51023,regulation of immunoglobulin secretion,biological process,2637,regulation of immunoglobulin production,50708,regulation of protein secretion,,,,,"Any process that modulates the frequency, rate or extent of the regulated release of immunoglobulins from a cell or group of cells. [GOC:ai]"
0.011831,2000353,positive regulation of endothelial cell apoptotic process,biological process,43065,positive regulation of apoptotic process,2000351,regulation of endothelial cell apoptotic process,,,,,"Any process that activates or increases the frequency, rate or extent of endothelial cell apoptosis. [GOC:BHF, GOC:mah]"
0.022506,42491,auditory receptor cell differentiation,biological process,60113,inner ear receptor cell differentiation,,,,,,,"The process in which a relatively unspecialized cell acquires specialized features of an auditory hair cell. [CL:0000201, GOC:jl]"
0.022659,2839,positive regulation of immune response to tumor cell,biological process,2836,positive regulation of response to tumor cell,2837,regulation of immune response to tumor cell,50778,positive regulation of immune response,,,"Any process that activates or increases the frequency, rate, or extent of an immune response to tumor cell. [GOC:add]"
0.022659,7341,penetration of zona pellucida,biological process,48609,multicellular organismal reproductive process,,,,,,,"The infiltration by sperm of the zona pellucida to reach the oocyte. The process involves digestive enzymes from a modified lysosome called the acrosome, situated at the head of the sperm. [GOC:jl, http://arbl.cvmbs.colostate.edu/hbooks/pathphys/reprod/fert/fert.html]"
0.022659,50957,equilibrioception,biological process,7600,sensory perception,,,,,,,"The series of events required for an organism to receive an orientational stimulus, convert it to a molecular signal, and recognize and characterize the signal. Equilibrioception refers to a combination of processes by which an organism can perceive its orientation with respect to gravity. In animals, stimuli come from labyrinth system of the inner ears, monitoring the direction of motion; visual stimuli, with information on orientation and motion; pressure receptors, which tell the organism which body surfaces are in contact with the ground; and proprioceptive cues, which report which parts of the body are in motion. [http://www.medterms.com, http://www.onelook.com/]"
0.022659,1900116,extracellular negative regulation of signal transduction,biological process,9968,negative regulation of signal transduction,1900115,extracellular regulation of signal transduction,,,,,"Any negative regulation of signal transduction that takes place in extracellular region. [GOC:signaling, GOC:TermGenie]"
0.025012,51607,defense response to virus,biological process,2252,immune effector process,6952,defense response,9615,response to virus,,,Reactions triggered in response to the presence of a virus that act to protect the cell or organism. [GOC:ai]
0.0295,31214,biomineral tissue development,biological process,9888,tissue development,,,,,,,"Formation of hard tissues that consist mainly of inorganic compounds, and also contain a small amounts of organic matrices that are believed to play important roles in their formation. [PMID:15132736]"
0.036173,1960,negative regulation of cytokine-mediated signaling pathway,biological process,1959,regulation of cytokine-mediated signaling pathway,9968,negative regulation of signal transduction,60761,negative regulation of response to cytokine stimulus,,,"Any process that stops, prevents, or reduces the frequency, rate or extent of the cytokine mediated signaling pathway. [GOC:hjd]"
0.036173,32693,negative regulation of interleukin-10 production,biological process,1818,negative regulation of cytokine production,32653,regulation of interleukin-10 production,,,,,"Any process that stops, prevents, or reduces the frequency, rate, or extent of interleukin-10 production. [GOC:mah]"
0.036173,42476,odontogenesis,biological process,9887,organ morphogenesis,,,,,,,"The process whose specific outcome is the progression of a tooth or teeth over time, from formation to the mature structure(s). A tooth is any hard bony, calcareous, or chitinous organ found in the mouth or pharynx of an animal and used in procuring or masticating food. [GOC:jl, GOC:mah]"
0.036173,50901,leukocyte tethering or rolling,biological process,7159,leukocyte cell-cell adhesion,,,,,,,"Transient adhesive interactions between leukocytes and endothelial cells lining blood vessels mediated primarily by selectins and which are typically the first step in cellular extravasation. [ISBN:0781735149, PMID:14680625, PMID:14708592, PMID:7507411, PMID:8600538]"
0.045117,7166,cell surface receptor signaling pathway,biological process,7165,signal transduction,,,,,,,"A series of molecular signals initiated by activation of a receptor on the surface of a cell. The pathway begins with binding of an extracellular ligand to a cell surface receptor, or for receptors that signal in the absence of a ligand, by ligand-withdrawal or the activity of a constitutively active receptor. The pathway ends with regulation of a downstream cellular process, e.g. transcription. [GOC:bf, GOC:mah, GOC:pr, GOC:signaling]"
som_mouse_3_4,,,,,,,,,,,,
p-value,GO ID,Name,Type,Is a,,Is a,,Is a,,,,Description
0.0028321,43409,negative regulation of MAPK cascade,biological process,10741,negative regulation of intracellular protein kinase cascade,43408,regulation of MAPK cascade,,,,,"Any process that stops, prevents, or reduces the frequency, rate or extent of signal transduction mediated by the MAPKKK cascade. [GOC:go_curators]"
0.0099197,30593,neutrophil chemotaxis,biological process,30595,leukocyte chemotaxis,,,,,,,"The directed movement of a neutrophil cell, the most numerous polymorphonuclear leukocyte found in the blood, in response to an external stimulus, usually an infection or wounding. [GOC:jl, ISBN:0198506732]"
0.013814,10033,response to organic substance,biological process,42221,response to chemical stimulus,,,,,,,"Any process that results in a change in state or activity of a cell or an organism (in terms of movement, secretion, enzyme production, gene expression, etc.) as a result of an organic substance stimulus. [GOC:sm]"
som_mouse_3_5,,,,,,,,,,,,
p-value,GO ID,Name,Type,Is a,,Is a,,Is a,,,,Description
0.0029334,6997,nucleus organization,biological process,6996,organelle organization,,,,,,,"A process that is carried out at the cellular level which results in the assembly, arrangement of constituent parts, or disassembly of the nucleus. [GOC:dph, GOC:ems, GOC:jl, GOC:mah]"
0.007119,6520,cellular amino acid metabolic process,biological process,19752,carboxylic acid metabolic process,44106,cellular amine metabolic process,44238,primary metabolic process,,,"The chemical reactions and pathways involving amino acids, carboxylic acids containing one or more amino groups, as carried out by individual cells. [CHEBI:33709, GOC:curators, ISBN:0198506732]"
0.033393,10033,response to organic substance,biological process,42221,response to chemical stimulus,,,,,,,"Any process that results in a change in state or activity of a cell or an organism (in terms of movement, secretion, enzyme production, gene expression, etc.) as a result of an organic substance stimulus. [GOC:sm]"
0.033393,30261,chromosome condensation,biological process,6323,DNA packaging,51276,chromosome organization,,,,,"The progressive compaction of dispersed interphase chromatin into threadlike chromosomes prior to mitotic or meiotic nuclear division, or during apoptosis, in eukaryotic cells. [GOC:mah, ISBN:0815316194]"
som_mouse_3_6,,,,,,,,,,,,
p-value,GO ID,Name,Type,Is a,,Is a,,Is a,,,,Description
0.00071553,10887,negative regulation of cholesterol storage,biological process,10885,regulation of cholesterol storage,10888,negative regulation of lipid storage,,,,,"Any process that decreases the rate or extent of cholesterol storage. Cholesterol storage is the accumulation and maintenance in cells or tissues of cholesterol, cholest-5-en-3 beta-ol, the principal sterol of vertebrates and the precursor of many steroids, including bile acids and steroid hormones. [GOC:BHF, GOC:dph, GOC:tb]"
0.0041429,30195,negative regulation of blood coagulation,biological process,30193,regulation of blood coagulation,50819,negative regulation of coagulation,1900047,negative regulation of hemostasis,,,"Any process that stops, prevents, or reduces the frequency, rate or extent of blood coagulation. [GOC:mah]"
0.0097757,6633,fatty acid biosynthetic process,biological process,6631,fatty acid metabolic process,8610,lipid biosynthetic process,46394,carboxylic acid biosynthetic process,,,"The chemical reactions and pathways resulting in the formation of a fatty acid, any of the aliphatic monocarboxylic acids that can be liberated by hydrolysis from naturally occurring fats and oils. Fatty acids are predominantly straight-chain acids of 4 to 24 carbon atoms, which may be saturated or unsaturated; branched fatty acids and hydroxy fatty acids also occur, and very long chain acids of over 30 carbons are found in waxes. [GOC:mah, ISBN:0198506732]"
0.013395,8217,regulation of blood pressure,biological process,65008,regulation of biological quality,,,,,,,"Any process that modulates the force with which blood travels through the circulatory system. The process is controlled by a balance of processes that increase pressure and decrease pressure. [GOC:dph, GOC:mtg_cardio, ISBN:0721643949]"
0.01375,7214,gamma-aminobutyric acid signaling pathway,biological process,7186,G-protein coupled receptor signaling pathway,,,,,,,"The series of molecular signals generated by the binding of gamma-aminobutyric acid (GABA, 4-aminobutyrate), an amino acid which acts as a neurotransmitter in some organisms, to a cell surface receptor. [GOC:mah]"
0.01375,15671,oxygen transport,biological process,15669,gas transport,,,,,,,"The directed movement of oxygen (O2) into, out of or within a cell, or between cells, by means of some agent such as a transporter or pore. [GOC:ai]"
0.022755,7602,phototransduction,biological process,7165,signal transduction,9583,detection of light stimulus,,,,,The sequence of reactions within a cell required to convert absorbed photons into a molecular signal. [GOC:go_curators]
0.022755,8306,associative learning,biological process,7612,learning,,,,,,,Learning by associating a stimulus (the cause) with a particular outcome (the effect). [ISBN:0582227089]
0.022755,42953,lipoprotein transport,biological process,15031,protein transport,,,,,,,"The directed movement of any conjugated, water-soluble protein in which the nonprotein group consists of a lipid or lipids, into, out of or within a cell, or between cells, by means of some agent such as a transporter or pore. [GOC:jl, ISBN:0198506732]"
0.027949,50873,brown fat cell differentiation,biological process,45444,fat cell differentiation,,,,,,,"The process in which a relatively unspecialized cell acquires specialized features of a brown adipocyte, an animal connective tissue cell involved in adaptive thermogenesis. Brown adipocytes contain multiple small droplets of triglycerides and a high number of mitochondria. [PMID:12588810]"
0.033566,70328,triglyceride homeostasis,biological process,55088,lipid homeostasis,,,,,,,"Any process involved in the maintenance of an internal steady state of triglyceride within an organism or cell. [GOC:BHF, GOC:mah]"
0.039582,9725,response to hormone stimulus,biological process,9719,response to endogenous stimulus,10033,response to organic substance,,,,,"Any process that results in a change in state or activity of a cell or an organism (in terms of movement, secretion, enzyme production, gene expression, etc.) as a result of a hormone stimulus. [GOC:jl]"
som_mouse_4_1,,,,,,,,,,,,
p-value,GO ID,Name,Type,Is a,,Is a,,Is a,,,,Description
0.0016913,9253,peptidoglycan catabolic process,biological process,270,peptidoglycan metabolic process,6027,glycosaminoglycan catabolic process,,,,,"The chemical reactions and pathways resulting in the breakdown of peptidoglycans, any of a class of glycoconjugates found in bacterial cell walls. [http://www.dsmz.de/species/murein.htm, ISBN:0198506732]"
0.0016913,16045,detection of bacterium,biological process,9581,detection of external stimulus,9595,detection of biotic stimulus,9617,response to bacterium,,,The series of events in which a stimulus from a bacterium is received and converted into a molecular signal. [GOC:hb]
0.0016913,43537,negative regulation of blood vessel endothelial cell migration,biological process,10596,negative regulation of endothelial cell migration,43535,regulation of blood vessel endothelial cell migration,,,,,"Any process that stops, prevents, or reduces the frequency, rate or extent of the migration of the endothelial cells of blood vessels. [GOC:go_curators]"
0.006064,7154,cell communication,biological process,9987,cellular process,,,,,,,"Any process that mediates interactions between a cell and its surroundings. Encompasses interactions such as signaling or attachment between one cell and another cell, between a cell and an extracellular matrix, or between a cell and any other aspect of its environment. [GOC:mah]"
0.0072049,30334,regulation of cell migration,biological process,2000145,regulation of cell motility,,,,,,,"Any process that modulates the frequency, rate or extent of cell migration. [GOC:go_curators]"
0.0080636,1937,negative regulation of endothelial cell proliferation,biological process,1936,regulation of endothelial cell proliferation,50680,negative regulation of epithelial cell proliferation,,,,,"Any process that stops, prevents, or reduces the rate or extent of endothelial cell proliferation. [GOC:add]"
0.0080636,2089,lens morphogenesis in camera-type eye,biological process,9653,anatomical structure morphogenesis,,,,,,,"The process in which the anatomical structures of the lens are generated and organized. The lens is a transparent structure in the eye through which light is focused onto the retina. An example of this process is found in Mus musculus. [GOC:dph, GOC:mtg_sensu]"
0.0080636,90200,positive regulation of release of cytochrome c from mitochondria,biological process,10822,positive regulation of mitochondrion organization,90199,regulation of release of cytochrome c from mitochondria,,,,,"Any process that increases the rate, frequency or extent of release of cytochrome c from mitochondria, the process in which cytochrome c is enabled to move from the mitochondrial intermembrane space into the cytosol, which is an early step in apoptosis and leads to caspase activation. [GOC:BHF, GOC:dph, GOC:tb]"
0.032286,2088,lens development in camera-type eye,biological process,48856,anatomical structure development,,,,,,,"The process whose specific outcome is the progression of the lens over time, from its formation to the mature structure. The lens is a transparent structure in the eye through which light is focused onto the retina. An example of this process is found in Mus musculus. [GOC:dph, ISBN:0582064333]"
